{
  "version": "v1.0",
  "generated_at": "2024-01-15T10:30:00Z",
  "repo": {
    "url": "https://github.com/example/project",
    "commit": "abc1234567890",
    "branch": "main"
  },
  "nodes": [
    {
      "node_id": "mod_main_12345678",
      "kind": "module",
      "name": "main",
      "language": "typescript",
      "file": "src/main.ts",
      "span": [0, 500],
      "visibility": "public"
    },
    {
      "node_id": "cls_user_87654321",
      "kind": "class",
      "name": "UserService",
      "language": "typescript",
      "file": "src/services/user.ts",
      "span": [50, 450],
      "parent": "mod_main_12345678",
      "visibility": "public",
      "route": "src/services/user.ts::UserService"
    },
    {
      "node_id": "mtd_getUser_11111111",
      "kind": "method",
      "name": "getUser",
      "language": "typescript",
      "file": "src/services/user.ts",
      "span": [100, 200],
      "parent": "cls_user_87654321",
      "visibility": "public",
      "signature": "(id: string) => Promise<User>"
    },
    {
      "node_id": "func_helper_22222222",
      "kind": "function",
      "name": "validateInput",
      "language": "typescript",
      "file": "src/utils/validate.ts",
      "span": [0, 150],
      "visibility": "public",
      "signature": "(input: unknown) => boolean"
    }
  ],
  "edges": [
    {
      "edge_id": "edge_calls_33333333",
      "kind": "calls",
      "src": "mtd_getUser_11111111",
      "dst": "func_helper_22222222",
      "confidence": 0.95,
      "evidence": ["static_analysis", "lsp"]
    },
    {
      "edge_id": "edge_imports_44444444",
      "kind": "imports",
      "src": "cls_user_87654321",
      "dst": "func_helper_22222222",
      "confidence": 1.0,
      "evidence": ["static_analysis"]
    }
  ],
  "annotations": [
    {
      "target_id": "cls_user_87654321",
      "tags": ["service", "core", "user-management"],
      "kv": {
        "priority": 1,
        "deprecated": false,
        "maintainer": "team-platform"
      }
    },
    {
      "target_id": "mtd_getUser_11111111",
      "tags": ["async", "database"]
    }
  ],
  "patterns": [
    {
      "instance_id": "pattern_singleton_55555555",
      "pattern_id": "SINGLETON",
      "roles": {
        "class": "cls_user_87654321",
        "getInstance": "mtd_getUser_11111111"
      },
      "confidence": 0.85,
      "evidence": ["Single instance pattern detected", "Private constructor present"],
      "explain": "UserService follows singleton pattern with private constructor and static getInstance method"
    }
  ]
}
